<?xml version="1.0" encoding="UTF-8" standalone="no"?>
<!DOCTYPE people SYSTEM "people.dtd">
<people>
	<person gender="M">
		<name>David</name>
		<age>40</age>
	</person>
	<person gender="F">
		<name>Tamar</name>
		<age>35</age>
	</person>
	<person gender="M">
		<name>Moshe</name>
		<age>11</age>
	</person>
</people>